{
  "$schema": "http://json-schema.org/draft-07/schema#",
  "$id": "uniflow-work-item-v2",
  "title": "UniFlow V2 WorkItem",
  "description": "Leader 下发给 SubAgent 的可移植执行意图（派发协议，非任务系统）：一个 Fresh Agent 能独立理解、独立执行、独立验证的最小委派单元。Self-contained, but not self-bloated.",
  "type": "object",
  "required": ["id", "objective", "scope", "semantic_brief", "acceptance", "forbidden"],
  "properties": {
    "id": {
      "type": "string",
      "pattern": "^WI-[A-Z0-9][A-Z0-9-]*$",
      "description": "唯一标识，如 WI-EXAMPLE-001"
    },
    "objective": {
      "type": "string",
      "minLength": 1,
      "description": "做什么、为什么（一句话目标；与 semantic_brief.summary 不重复）"
    },
    "scope": {
      "type": "object",
      "required": ["write"],
      "properties": {
        "write": { "type": "array", "items": { "type": "string" }, "description": "允许写入的路径" },
        "read_hints": { "type": "array", "items": { "type": "string" }, "description": "建议按需读取的路径/线索" }
      },
      "additionalProperties": false
    },
    "semantic_brief": {
      "type": "object",
      "required": ["summary"],
      "properties": {
        "summary": { "type": "string", "description": "语义定位摘要（≤240 字），仅助 Worker 快速定位，不构成约束" },
        "core_points": { "type": "array", "items": { "type": "string" }, "maxItems": 5, "description": "关键点；含强制语汇时必须同时落在正式约束字段" }
      },
      "additionalProperties": false
    },
    "anchors": {
      "type": "array",
      "items": {
        "type": "object",
        "required": ["path"],
        "properties": { "path": { "type": "string" }, "symbol": { "type": "string" } },
        "additionalProperties": false
      },
      "description": "代码/文档锚点，按需加载"
    },
    "contract_refs": {
      "type": "array",
      "items": { "type": "string" },
      "description": "权威契约引用（docs/adr/ 或 plans/ 内工件）"
    },
    "acceptance": {
      "type": "array",
      "minItems": 1,
      "items": { "type": "string" },
      "description": "完成条件；Complete 判定只依据 acceptance + evidence"
    },
    "forbidden": {
      "type": "array",
      "items": { "type": "string" },
      "description": "禁止事项（越界路径、禁改契约等）"
    },
    "frozen_decisions": {
      "type": "array",
      "items": { "type": "string" },
      "description": "本 WorkItem 不得重新裁决的已冻结决策引用"
    },
    "dependencies": {
      "type": "array",
      "items": { "type": "string" },
      "description": "前置 WorkItem id（DAG）；有依赖的串行执行"
    },
    "status": {
      "type": "string",
      "enum": ["pending", "in_progress", "done", "blocked", "rejected"],
      "default": "pending",
      "description": "派发生命周期状态，由 UniFlow/Leader 维护（workitems/README.md 约定）；创建时缺省为 pending"
    },
    "required_skills": {
      "type": "array",
      "items": {
        "type": "string",
        "enum": ["grilling", "grill-with-docs", "domain-modeling", "codebase-design", "tdd", "code-review", "diagnosing-bugs", "show-me", "setup-matt-pocock-skills"]
      },
      "description": "有序 Skill 名；从 .agents/skills/ 唯一解析，缺失即 fail-closed"
    },
    "required_capability": {
      "type": "string",
      "description": "能力要求（交由 model-routing 解析 tier）；Skill/WorkItem 不绑定具体模型"
    },
    "role_profile": { "type": "string", "description": "optional：仅多人治理需要时填写" },
    "execution_profile": { "type": "string", "description": "optional：可由 capability 推导时不得强制" },
    "module_profile": { "type": "string", "description": "optional：模块边界稳定且反复接任务时使用" },
    "worker_owner": { "type": "string", "description": "optional：唯一执行者；派发机制可推导时不填" }
  },
  "additionalProperties": false
}
