{
  "id": "WI-RUNTIME-PLAN-001-RETRY-FIX",
  "objective": "Fix retry decision identity and physical turn serialization exposed by the real baseline, via public route/tool regressions",
  "scope": {
    "write": [
      "dsh/uniclaw-decision-channel/src/index.js",
      "dsh/uniclaw-decision-channel/tests/plugin.test.mjs",
      "evidence/runtime-plan-001/protocol/retry-*"
    ],
    "read_hints": [
      "evidence/runtime-plan-001/protocol/baseline-failure-diagnosis.md",
      "evidence/runtime-plan-001/comparison/known-path/Step/1/trial.json"
    ]
  },
  "semantic_brief": {
    "summary": "扩展已有Plan而非新执行器；Kernel唯一Run驱动，逐动作当前guard+Control+grounding+Assurance+Effect+verify。Leader拥有Host/wire/文档；Worker独占Kernel及其测试。"
  },
  "contract_refs": [
    "changes/RUNTIME-PLAN-001/implementation-contract.md",
    "docs/adr/0053-composable-product-plan-with-bounded-local-execution.md"
  ],
  "acceptance": [
    "Run identity regression against old implementation RED, then minimal fix GREEN",
    "Retry capture waits for physical turn/end before admitting next consultation",
    "Keep retry count, timeout, model, permission and proxy unchanged; preserve failure logs"
  ],
  "forbidden": [
    "No subagents, model change, device, real model, commit, push, reset or cleanup",
    "Run targeted Node regression only while owning the unique heavy slot",
    "Do not modify frozen semantics or original failed trials"
  ],
  "frozen_decisions": [
    "RUNTIME-PLAN-001 D1-D10",
    "implementation-contract.md"
  ],
  "required_skills": [
    "diagnosing-bugs",
    "tdd"
  ],
  "status": "done"
}
